{
  "$schema": "https://json-schema.org/draft/2020-12/schema",
  "title": "Peek-Then-Pay Embed Intent Response",
  "description": "Numeric vector representations (embeddings) for a resource or its regions, with provenance and token accounting.",
  "type": "object",
  "properties": {
    "intent": {
      "type": "string",
      "const": "embed",
      "description": "Intent type identifier"
    },
    "canonicalUrl": { "type": "string", "format": "uri" },
    "language": {
      "type": "string",
      "description": "BCP-47 tag of the source/selection (use \"und\" for non-linguistic media)."
    },
    "contentType": { "$ref": "common-defs.schema.json#/$defs/contentType" },
    "mediaType": { "$ref": "common-defs.schema.json#/$defs/mediaType" },
    "normalization": { "$ref": "common-defs.schema.json#/$defs/baseNormalization" },
    "provenance": {
      "allOf": [
        { "$ref": "common-defs.schema.json#/$defs/baseProvenance" },
        {
          "properties": {
            "vectorDimensions": {
              "type": "integer",
              "minimum": 1,
              "description": "Number of dimensions in embedding vectors"
            },
            "chunkingMethod": {
              "type": "string",
              "enum": ["doc", "chunks", "selection"],
              "description": "How source was partitioned for embedding"
            },
            "chunkSize": {
              "type": "integer",
              "minimum": 1,
              "description": "Size of chunks when chunking method is 'chunks'"
            },
            "chunkOverlap": {
              "type": "integer",
              "minimum": 0,
              "description": "Overlap between adjacent chunks"
            },
            "chunkUnit": {
              "type": "string",
              "enum": ["token", "utf8", "char"],
              "description": "Unit of measurement for chunk size"
            }
          },
          "required": ["generatedAt", "model", "vectorDimensions", "chunkingMethod"]
        }
      ]
    },
    "embeddingMetadata": {
      "type": "object",
      "description": "Global embedding configuration.",
      "properties": {
        "dtype": { "type": "string", "enum": ["f32", "f16", "q8"] },
        "normalized": { "type": "boolean", "description": "L2-normalized vectors." },
        "encode": { "type": "string", "enum": ["array", "base64"], "default": "array" },
        "num_items": { "type": "integer", "minimum": 0 }
      },
      "required": ["dtype", "encode"]
    },
    "length": { "$ref": "common-defs.schema.json#/$defs/baseLength" },
    "embeddings": {
      "type": "array",
      "description": "Per-item vectors with source localization.",
      "items": {
        "type": "object",
        "properties": {
          "index": { "type": "integer", "minimum": 0 },
          "embedding": {
            "description": "Vector as numeric array (present when encode=array).",
            "type": "array",
            "items": { "type": "number" },
            "minItems": 1
          },
          "b64": {
            "description": "Base64-encoded vector bytes (present when encode=base64).",
            "type": "string",
            "contentEncoding": "base64"
          },
          "meta": {
            "type": "object",
            "description": "Localizing metadata for this item.",
            "properties": {
              "span": {
                "type": "object",
                "properties": {
                  "start": { "type": "integer", "minimum": 0 },
                  "end": { "type": "integer", "minimum": 0 },
                  "unit": {
                    "type": "string",
                    "enum": ["token", "utf8", "char"],
                    "default": "token"
                  }
                },
                "required": ["start", "end"],
                "additionalProperties": false
              },
              "selector": {
                "type": "string",
                "description": "CSS selector / element id for region, if applicable."
              },
              "sectionId": { "type": "string" },
              "itemId": {
                "type": "string",
                "description": "Stable publisher id for this block/asset."
              },
              "textHash": {
                "type": "string",
                "description": "Hash of text span used to generate the vector."
              },
              "assetRef": {
                "type": "string",
                "format": "uri",
                "description": "For image/audio/video embeddings."
              },
              "language": { "type": "string", "description": "Overrides global language if mixed." }
            },
            "additionalProperties": false
          }
        },
        "required": ["index"],
        "additionalProperties": false
      }
    }
  },

  "required": [
    "intent",
    "canonicalUrl",
    "language",
    "contentType",
    "mediaType",
    "embeddingMetadata",
    "provenance",
    "embeddings"
  ],
  "additionalProperties": false,

  "allOf": [
    {
      "if": {
        "properties": { "embeddingMetadata": { "properties": { "encode": { "const": "array" } } } }
      },
      "then": {
        "properties": { "embeddings": { "items": { "required": ["index", "embedding"] } } }
      }
    },
    {
      "if": {
        "properties": { "embeddingMetadata": { "properties": { "encode": { "const": "base64" } } } }
      },
      "then": { "properties": { "embeddings": { "items": { "required": ["index", "b64"] } } } }
    }
  ]
}
